### ISSUE TITLE
Jellyfin Server Crashing

### ISSUE THREAD

**Issue by Dia2809** [dragonflylee/switchfin#128]
### Describe the bug

Hey Guys, i was just trying this wonderful application out on a linux aarch64 based Handheld, i found it pretty cool to have jellyfin on that but apperantly its crashing the whole Server application on my server

Thank and if anyone got some more information about why this is happening that would be great!
```


[20:28:58] [ERR] [8] Jellyfin.Api.Middleware.ExceptionMiddleware: Error processing request. URL POST /Users/authenticatebyname.
System.ArgumentNullException: Value cannot be null. (Parameter 'request.DeviceId')
   at System.ArgumentNullException.Throw(String paramName)
   at System.ArgumentNullException.ThrowIfNull(Object argument, String paramName)
   at System.ArgumentException.ThrowNullOrEmptyException(String argument, String paramName)
   at System.ArgumentException.ThrowIfNullOrEmpty(String argument, String paramName)
   at Emby.Server.Implementations.Session.SessionManager.AuthenticateNewSessionInternal(AuthenticationRequest request, Boolean enforcePassword)
   at Jellyfin.Api.Controllers.UserController.AuthenticateUserByName(AuthenticateUserByName request)
   at lambda_method358(Closure, Object)
   at Microsoft.AspNetCore.Mvc.Infrastructure.ActionMethodExecutor.AwaitableObjectResultExecutor.Execute(ActionContext actionContext, IActionResultTypeMapper mapper, ObjectMethodExecutor executor, Object controller, Object[] arguments)
   at Microsoft.AspNetCore.Mvc.Infrastructure.ControllerActionInvoker.<InvokeActionMethodAsync>g__Awaited|12_0(ControllerActionInvoker invoker, ValueTask`1 actionResultValueTask)
   at Microsoft.AspNetCore.Mvc.Infrastructure.ControllerActionInvoker.<InvokeNextActionFilterAsync>g__Awaited|10_0(ControllerActionInvoker invoker, Task lastTask, State next, Scope scope, Object state, Boolean isCompleted)
   at Microsoft.AspNetCore.Mvc.Infrastructure.ControllerActionInvoker.Rethrow(ActionExecutedContextSealed context)
   at Microsoft.AspNetCore.Mvc.Infrastructure.ControllerActionInvoker.Next(State& next, Scope& scope, Object& state, Boolean& isCompleted)
   at Microsoft.AspNetCore.Mvc.Infrastructure.ControllerActionInvoker.InvokeInnerFilterAsync()
--- End of stack trace from previous location ---
   at Microsoft.AspNetCore.Mvc.Infrastructure.ResourceInvoker.<InvokeNextResourceFilter>g__Awaited|25_0(ResourceInvoker invoker, Task lastTask, State next, Scope scope, Object state, Boolean isCompleted)
   at Microsoft.AspNetCore.Mvc.Infrastructure.ResourceInvoker.Rethrow(ResourceExecutedContextSealed context)
   at Microsoft.AspNetCore.Mvc.Infrastructure.ResourceInvoker.Next(State& next, Scope& scope, Object& state, Boolean& isCompleted)
   at Microsoft.AspNetCore.Mvc.Infrastructure.ResourceInvoker.InvokeFilterPipelineAsync()
--- End of stack trace from previous location ---
   at Microsoft.AspNetCore.Mvc.Infrastructure.ResourceInvoker.<InvokeAsync>g__Awaited|17_0(ResourceInvoker invoker, Task task, IDisposable scope)
   at Microsoft.AspNetCore.Mvc.Infrastructure.ResourceInvoker.<InvokeAsync>g__Awaited|17_0(ResourceInvoker invoker, Task task, IDisposable scope)
   at Jellyfin.Api.Middleware.ServerStartupMessageMiddleware.Invoke(HttpContext httpContext, IServerApplicationHost serverApplicationHost, ILocalizationManager localizationManager)
   at Jellyfin.Api.Middleware.WebSocketHandlerMiddleware.Invoke(HttpContext httpContext, IWebSocketManager webSocketManager)
   at Jellyfin.Api.Middleware.IPBasedAccessValidationMiddleware.Invoke(HttpContext httpContext, INetworkManager networkManager)
   at Jellyfin.Api.Middleware.LanFilteringMiddleware.Invoke(HttpContext httpContext, INetworkManager networkManager, IServerConfigurationManager serverConfigurationManager)
   at Microsoft.AspNetCore.Authorization.AuthorizationMiddleware.Invoke(HttpContext context)
   at Jellyfin.Api.Middleware.QueryStringDecodingMiddleware.Invoke(HttpContext httpContext)
   at Swashbuckle.AspNetCore.ReDoc.ReDocMiddleware.Invoke(HttpContext httpContext)
   at Swashbuckle.AspNetCore.SwaggerUI.SwaggerUIMiddleware.Invoke(HttpContext httpContext)
   at Swashbuckle.AspNetCore.Swagger.SwaggerMiddleware.Invoke(HttpContext httpContext, ISwaggerProvider swaggerProvider)
   at Microsoft.AspNetCore.Authentication.AuthenticationMiddleware.Invoke(HttpContext context)
   at Jellyfin.Api.Middleware.RobotsRedirectionMiddleware.Invoke(HttpContext httpContext)
   at Jellyfin.Api.Middleware.LegacyEmbyRouteRewriteMiddleware.Invoke(HttpContext httpContext)
   at Microsoft.AspNetCore.ResponseCompression.ResponseCompressionMiddleware.InvokeCore(HttpContext context)
   at Jellyfin.Api.Middleware.ResponseTimeMiddleware.Invoke(HttpContext context, IServerConfigurationManager serverConfigurationManager)
   at Jellyfin.Api.Middleware.ExceptionMiddleware.Invoke(HttpContext context)
```

### To reproduce

compile for aarch64 and just try to connect to a server

### Operating system

muOS ( you wont know this but it is a OS made for aarch64 handhelds )

### Jellyfin Server

10.10.7 ( Kubuntu 25.04)

**Comment by dragonflylee** [comment]
deviceId is empty based on your log 
try this commit to fix https://github.com/dragonflylee/switchfin/commit/00e2a8c844dcb7c536a6f4abf5a94c2255455e67

**Comment by Dia2809** [comment]
try that now too, still not working but i forgot to add that part down below yesterday, so here it that is 

`21:09:50.061[INFO] login header X-Emby-Authorization: MediaBrowser Client="Switchfin", Device="sun50iw9", DeviceId="4513705c6b0a6e68cbe62e11f296a6a9", Version="0.7.2"`

I forgot to say that im using` ccmake -G Ninja -DCMAKE_CXX_FLAGS="-std=gnu++14 -O1 -g`" too, my Settings are DESKTOP, GLES2, SDL2 and System curl

Im using a custom mpv version, i think a curl one too?

**Comment by Dia2809** [comment]
just found out about the debug thingys

`21:56:59.143[DEBUG] report event: {"client_id":"GA1.3.4513705c6b0a6e68cbe62e11f296a6a9","events":[{"name":"open_app","params":{"engagement_time_msec":100,"git":"00e2a8c","language":"en-US","os":"Linux","resolution":"640x480","session_id":"GA1.3.4513705c6b0a6e68cbe62e11f296a6a9","version":"0.7.2"}}],"timestamp_micros":1751572619016696,"user_id":"","user_properties":{"platform":{"value":"Linux"}}}
`

**Comment by Dia2809** [comment]
```
22:18:42.449284 wlp98s0 In  IP 192.168.178.192.55350 > tufgamingA16Linux.fritz.box.8096: Flags [P.], seq 1:309, ack 1, win 229, options [nop,nop,TS val 501842 ecr 2940622524], length 308
E..h.7@.@............6....gs..ap....l......
...R.FV.POST /Users/authenticatebyname HTTP/1.1
Host: 192.168.178.161:8096
User-Agent: Switchfin/0.7.2 (Linux)
Accept: */*
Accept-Encoding: deflate, gzip, br
Content-Type: application/json
X-Emby-Authorization: MediaBrowser Client="Switchfin", Device="sun50iw9
Content-Length: 26

{"Pw":"","Username":"lol"}
22:18:42.449313 wlp98s0 Out IP tufgamingA16Linux.fritz.box.8096 > 192.168.178.192.55350: Flags [.], ack 309, win 507, options [nop,nop,TS val 2940622540 ecr 501842], length 0
E..4..@.@.y*...........6..ap..h............
.FV....R
22:18:42.451734 wlp98s0 Out IP tufgamingA16Linux.fritz.box.8096 > 192.168.178.192.55350: Flags [P.], seq 1:201, ack 309, win 507, options [nop,nop,TS val 2940622542 ecr 501842], length 200
E.....@.@.xa...........6..ap..h............
.FV....RHTTP/1.1 400 Bad Request
Content-Type: text/plain
Date: Thu, 03 Jul 2025 20:18:42 GMT
Server: Kestrel
Transfer-Encoding: chunked
X-Response-Time-ms: 1.9998

19

```

hopefully i didnt forgot anything but its cut for some reason

**Comment by Dia2809** [comment]
okay nvm got it now actually, just actual streaming is now broken

I needed to hard code the Device= so it works, im wondering why it gave a null byte each time

**Comment by dragonflylee** [comment]
@Damian2809   maybe there was some unprintable chars at end of string
fixed in https://github.com/dragonflylee/switchfin/commit/c695a544b53052ce1f505dd7a74978cb265718a7

**Comment by Dia2809** [comment]
do you know what features/decoders and such i need for mpv/ffmpeg

**Comment by dragonflylee** [comment]
@Damian2809

ffmpeg config option can be found in https://github.com/dragonflylee/switchfin/blob/dev/scripts/flatpak.yaml#L135

for hardware decode please refer https://forum.armbian.com/topic/50617-x264-hw-encoding-on-orange-pi-zero-2w/

ffmpeg-v4l2request patch is need from https://github.com/jernejsk/FFmpeg/tree/v4l2-request-n7.1/
mpv-v4l2request is  need from https://github.com/philipl/mpv/tree/v4l2request

**Comment by Dia2809** [comment]
100 48800  100 48800    0     0   923k      0 --:--:-- --:--:-- --:--:--  934k20:10:53.556[DEBUG] MPVCore replace (http://192.168.178.161:8096/Videos/2b967610ee5dcfea82f9a52f49a4338e/stream?tag=27ea1616870b7b89bbe4faaa081595d7&playSessionId=045d7964ee814c0cb04a2691905f9947&mediaSourceId=2b967610ee5dcfea82f9a52f49a4338e&static=true) extra: (network-timeout=30)
20:10:53.570[INFO] MPVCore => EVENT_START_FILE
20:10:53.570[ERROR] MPVCore => FILE ERROR: loading failed


I just cant get it to work on here

**Comment by dragonflylee** [comment]
@Damian2809 can you get log with arg `-d -t`

**Comment by dragonflylee** [comment]
@Damian2809 
here is my port of libmpv for trimui [libmpv-dev.tar.gz](https://github.com/user-attachments/files/21225088/libmpv-dev.tar.gz)

build scrpit please refer https://github.com/dragonflylee/trimui-port

**Comment by Dia2809** [comment]
Wait you own a Trimui ????

If it's a Smart Pro or Brick, do you know PortMaster and maybe want to port it. That was actually what I was trying to do but if you own a device then I don't wanna steal your work

**Comment by Dia2809** [comment]
omg it works!!!! I love you!!!

**Comment by Dia2809** [comment]
Okay one little last question is it possible to run files locally instead from a server like you had done for the switch?

**Comment by dragonflylee** [comment]
@Damian2809 yes, just put config.json as follow

```json
{
  "remotes": [
    {
      "name": "local",
      "url": "file:///mnt/SDCARD"
    }
  ]
}
```

**Comment by Dia2809** [comment]
Okay really thanks i will now close this!

**Comment by dragonflylee** [comment]
@Dia2809 dbus depend was removed by https://github.com/dragonflylee/borealis/commit/99109074a273d739bc1bbfa09f57e8728b0122a0 now

trimui port is here https://github.com/dragonflylee/trimui-port/releases/download/tg5040/Switchfin-tg5040.7z
